,review_id,date,rating,text,num_likes,Vader_score,Vader_neg,Vader_neu,Vader_pos,TextBlob_sub,Flair_sent,Flair_conf
96,1981195402,06/07/2019,2.0,"★1/2I almost never read trilogy's or series. I sometimes really enjoy the first, but just don’t get around to finishing the rest. Point in case - I gave a rare 5 star to both The Hunger Games AND The Golden Compass but then both of the rest of the series’ sat on my shelf for over 2 years. I’ve never really understood the reason why they haven't appealed to me - but after completing both series over the last month, & being so horribly disappointed in both - I have decided I really ought to just trust my instincts & not bother. The first in this series The Golden Compass was an outstanding book in my opinion. The whole concepts of daemons was totally original - & bizarrely enough, almost kind of relatable. Mrs Coulter is deliciously malevolent & the alethiometer is fascinating. Like most good young adult books, its strength lay in the simplicity of the story & the excellent world building. I liked Lyra & I was totally engaged in her world. Then came The Subtle Knife. I was disappointed in this straight away - its like a totally different book! Lyra becomes a side character - daemons are suddenly barely relevant - there is a whole host of new characters & side stories that are supposedly leading to somewhere - so whatever…. Obviously Mr Pullman had a completely different concept for this story - it was frustrating but the writing is still reasonable & the story (while confusing) is still ok.But this…. wow… This flaws in the book are vast and numerous. Firstly, its waaaay too long. 520 pages is long for an adult book - but for the target audience, its just crazy - especially when most of it is pure filler. I admit to skimming a good 1oo pages of this because it was just utterly tedious and a huge chore.There are far too many characters! A lot more are introduced in this book (important characters!) but I couldnt have cared less about any of them by this point, or even fathom the purpose of most of them. There is ZERO character development and nobody has any personality at all. Will & especially Lyra are just hollow shadows of their former selves. Mrs Coulter's flip flop is beyond ludicrous & she goes from being on of the most interesting characters in the series to one of the most boring .The plot is totally confusing. I can honestly say I didn’t really have a clue as to what the hell was actual going on. The over-complicated plot lines are totally disengaging. Mary Malone's side story is pointless & takes up a huge portion of the book. Other than being obviously anti - church, I just don’t think Philip Pullman had any ideas where this story was going & just kept adding in extra plots that sounded kind of interesting in an effort to grab readers. I really have no idea what dust was supposed to be & what about all those angels? Why was it suddenly so important to go to the land of the dead? - important enough to leave their daemons behind?!! What about Wills mother & the people chasing him? Just like the folded paper, plot points are left hanging, others have gone in different directions & none of this made any sense. I don’t get it & I don’t care enough to think about trying to get it. Its like one of those huge blockbuster films with a crap storyline but heaps of special effects. I always hated those films… give me low budget with a good script any day. An Will & Lyra’s true love? What? - Puh -lease!!! They’re 12 yrs old!!! Apparently a lot of people have a problem with the anti religious themes in the book. I rarely care if an author has a political or religious motivation, in fact I tend to think that a lot of people overthink these things. For example, the amount of readers who are offended by racism in books that were written over 100 years ago in a totally different cultural climate is bizarre to me… for crying out loud just take the story in its context!!But I digress… Reading for me is first & foremost about entertainment, and as long as I am entertained, I don’t really care what the personal motivation of the author is. I do however, have a problem with crappy writing. On a personal level, I understand the aversion to organised religion, I just don’t get why its was so bad in the context of this book. I mean we’re told its bad, but where is the evidence of it in the narrative? I can come on board with the concept - but you have to show me why I should believe something - not just tell me I should. The last 60 pages or so ARE pretty heavy handed but to be honest, by the time I got half way through this 	book I was so utterly bored & disengaged that I couldn’t even have cared. Between this & Mockingjay, its back to stand alones for me.",5,0.9881,0.127,0.712,0.161,0.5508274133274134,NEGATIVE,1.0
97,3017176791,10/31/2019,5.0,"It was lovely visiting my old friends on audio this time. The whole voice cast is good, but the main narrator maintains a sense of wonder in his voice that is a real pleasure. Now, on to Secret Commonwealth!Update: I have just learned that the main narrator is Philip Pullman himself, because of course it is.",10,0.8943,0.0,0.807,0.193,0.4520833333333334,POSITIVE,0.9652
98,3486947593,08/09/2020,5.0,"I finished my reread of the His Dark Materials trilogy! I loved these books when I was a kid, but I hadn’t reread them since I was 14ish. I was scared I would hate them. I didn’t! Rereading the series was tons of fun, and the books are still clever and creepy. If you’re not familiar with this series, it’s about two kids who can open doors to parallel universes. The worldbuilding is stunning. I love how distinct—yet believable—each of the universes are. The author is not kind to his characters. This series gets dark. I think that’s why I loved it as a kid.I do have some criticisms that I didn’t notice as a teen. The beginnings of the first and third book are excruciatingly slow. Some events happen too easily or conveniently. Whenever the main character gets in trouble, someone shows up at the last second to save her. Those are minor criticisms. I highly recommend this series. I’m still deciding if I want to read the other books set in this world. If you’ve read them, are they good?Do you like opinions, giveaways, and bookish nonsense? I have a blog for that.",5,0.9256,0.13,0.686,0.184,0.470576923076923,POSITIVE,0.7537
99,4229520132,10/04/2021,5.0,"Bitter-sweet ending to a pretty heavy children's book. Quite liked it, definitely would recommend!",5,0.9011,0.0,0.428,0.572,0.7,POSITIVE,0.9997
100,3684741153,12/12/2020,5.0,"Wow! What a finish! Pullman pulled a rabbit out of his hat with this trilogy. The ending beyond belief. Happy and sad at the same time. A menagerie of ghosts, animals, witches and things that go bump in the night. Through it all, our heroine and hero plod together and never lose faith in each other.The underlying theme? Religion. Zealots dictating what other ""have"" to believe in. Think the Spanish Inquisition or modern day ISIS. Philip Pullman is dead set against such behavior and attacks it head on in this finale.",5,0.4606,0.149,0.692,0.159,0.49,POSITIVE,0.9175
101,1616578156,04/21/2016,5.0,"The Amber Spyglass is the third book in Philip Pullman’s His Dark Materials trilogy, and whilst I don’t think I enjoyed it as much as the other two, I still thought it was amazing. It’s also the only book that’s ever made me cry – the ending left me distraught, but it was beautiful. Of course, you should read each of the books in the series for maximum enjoyment, as you can only really fully appreciate the end of the series if you’ve been there since the start.I don’t want to talk directly about the plot here, because it follows on from the other two books and so if you haven’t read those yet, there’ll be spoilers. What I can say, though, is that in this book, all of the little story lines are wrapped up, and you’re in from a gripping tale from start to finish, which crosses the boundaries of multiple worlds. Along the way, you’ll meet some new characters and some old ones, and you’ll see some of those same characters get ruthlessly murdered by Pullman like he’s impersonating George R. R. Martin. But it works.We also learn a lot more about the nature of Dust, thanks to Mary Malone, an underrated character who turns out to be surprisingly important. Couple that with a huge, all-out war between Lord Asriel and the Authority, as well as a quick visit to the world of the dead, and you can see how you might be in for a treat. And this despite it being the weaker of the three books in the trilogy, in my opinion – Northern Lights was easily my favourite, in case you’re wondering.This book, and the other books in the series, are examples of those rare books that blow your mind – I almost find it hard to believe that a mere mortal could’ve created a book something as powerful as this. For me, Pullman’s world-building is more vivid and evocative than that of almost any other writer, with the possible exception of Sir Terry Pratchett – Tolkien and C. S. Lewis don’t even stand a chance. But then, without them, the His Dark Materials trilogy might not have existed – there are certainly parallels, such as the ability to pass from one world to another, but Pullman makes them his own.The characterisation is also exceptional, and it’s interesting to watch the subtle changes in Lyra and Will as they grow from children to young adults, and how those changes influence their decisions and, ultimately, the story line. Their daemons change as well, which is interesting – in fact, I’ve always been fascinated by the way that Pullman managed to make humans and their daemons both similar and different. It helps to make them believable, and it also adds an extra level to the story because a human and their daemon might not always agree on things.Overall, this book comes highly recommended from me, but so do the other two books in the series. Make sure that you read all three, and that you read them in order – these are books that will stand up to the test of time. Let me know your thoughts!",5,0.9938,0.05,0.809,0.141,0.5551826465715355,POSITIVE,0.9999
102,2216218783,04/04/2018,1.0,"Short review: Allegedly child sex must occur in order to save the Universes, but now to keep the Universes from being destroyed, the children must separate. A means to an end -a pointless, ripped from the Bible and twisted on its head- conclusion.My advice: If you love this series, stop reading this review.Long review, no spoilers – beware of RANT: I don’t know why I kept going. Curiosity, probably.Ok, fine, I’m not being fair and I am willing to admit that. I rate my books on enjoyment because I am human and this is platform exists so opinions can be expressed -> I did not enjoy it.The worldbuilding is wonderful, truly. Whimsical, Quirky, wacky. Combining science, fiction, steampunk technology, religion and magical elements. He had material for 5 separate books. Did we really need angels thrown into this already stuffed and random cluster of parallel universes? Did we? Are you sure? I mean without the angels to answer all the question (in Pullman fashion), how would we know what this was all about? Corruption of man, the Church is Evil, reaching adolescence, having blind faith in your loved ones, being a cruel megalomaniac – all good topics, but why oh why throw them all in this bucket of exotic gumbo?Characters: Lyra and whatshisname Boy Wonder, they did have a lot of growth – constantly pushing their limits and fighting for their beliefs. That ending really robbed them blind.Mary’s storyline was the only thing that kept me going – I was truly invested in how she’d manage and survive in the Mulefa society and the creativity used in developing this new world is truly astounding – if wasted as this is a parallel story that has almost nothing to do with the main plot.The Big War and the Journey into the Underworld? Yawn. Overall, this book and series should be read at a younger age (according to my friends that love it and have nostalgia goggles). Having quite a few books under my belt, I can easily compare and pinpoint my annoyances. Let’s just say it took me 3 weeks to read this and 3 days to read Sanderson’s Well of Ascension.Bonus: It finally ended, hooray! Common concern: The ending. If you do make it all the way there, please, leave a comment and tell me why you bothered. Perhaps you can shed some light on some positive aspects of this series so I might be enlightened.Rating: 1.5 stars. Unreadable. Pretentious and boring. Never thought I’d find a book more challenging to finish than Return of the King. At least I was invested in that story and characters.",5,0.9888,0.113,0.706,0.181,0.5794501133786847,NEGATIVE,1.0
103,10533991,12/16/2007,2.0,"Honestly, I tried. I tried to like this because I enjoyed the first two installments so much.But, Phil, please. The elephants? We'd only so recently met Mary to actually care about her for looooong stretched with the elephants on wheels and their cruel nemeses the pooping birds.What happened to the startling, luxurious, carefully rendered worlds of The Golden Compass and The Subtle Knife? The Will/Lyra story was fine, but I can't ignore the hundreds of pages of the peaceful, seed-oiled wheel of the elephants.What happened to my gloriously, deliciously evil Mrs. Coulter? Earlier in the series she revealed true moments of love and caring--this is what made her even scarier. Now Marissa just seems a faded version of her earlier self: too soft to be as evil as she was, but the shadows of her previous cruelty are not fully excised so as to accept the nicer-Mrs. Coulter.Also, look, I understand all books and all authors have agendas. I don't care if you do, unless...you turn it into a Bible-thumping....err, anti-Bible-thumping sermon. It's not your having an agenda, or even your agenda itself that bothers me. In your first two installments, you portrayed many of the same ideas--subtly crafting them into the story and characters, building your case in the background. In Amber Spyglass, it appears you've grown weary of that backgroundy-subtle stuff. Whatever, obvious agendas don't always ruin a story, Orwell and Bradbury did it fine. BUT, and here is where I sadly click the only two stars to commemorate the end of what was a most promising and magical tale: You can't sacrifice the story or the characters to your agenda. You can't have the characters make decisions that don't seem to match the character you've so carefully crafted just because it gets your point across. You can't forget that what we readers loved about Will and Lyra was their staggering humanity: their flaws, weaknesses, quirks. We don't want WILL AND LYRA: EPIC SYMBOLS. We want Will, sad and broken little boy. We want Lyra, feisty liar with a soft heart.I don't think this work deserved the Whitbread Award. I'd have gladly seen the sticker on The Golden Compass or The Subtle Knife. If I had a copy with the sticker on it, I'd probably move it. ",5,0.9739,0.108,0.726,0.167,0.5874031007751938,NEGATIVE,0.999
104,1787342200,10/18/2016,2.0,"**Find this and other reviews, plus fun stuff, on my blogs! Booklikes or Blogspot**Basic InfoFormat: Audio Pages/Length: 12 FREAKING HOURSGenre: Young Adult; Fantasy Reason For Reading: ChallengeAt A GlanceLove Triangle/Insta Love/Obsession?: NoCliff Hanger: NoTriggers: n/aRating: 2 starsScore SheetAll out of tenCover:  7Plot: 4Characters: 5World Building: 5Flow:  3Series Congruity: 7Writing: 6Ending: 4Total: 4In DepthBest Part: Slow burn love!Worst Part: LONGGGGGGGGGGGThoughts Had: Stop nowConclusionContinuing the Series: n/aRecommending: EhShort Review: WHY IS THIS SO FREAKING LONGGGGGGGGGGGGGGGGGGGGGGGGGGGGGGGGG??????????????? You do see more of the anti Church stuff in this book (or at least i picked up on it more in this book). The natives picking up on the English was super cute. The MC were super cute as well, you can really see the ""love"" growing between them, and the whole ""universe"" saving sex part, i will overlook this, but come on, please don't tell middle age kids that sex could save the world, bad message. Misc. Book Boyfriend: Pass. Best Friend Material: Lyra ",5,0.9647,0.069,0.753,0.178,0.4513157894736843,NEGATIVE,0.9638
105,218875830,10/04/2011,2.0,"I found the first half of the book tedious but it picked up at the end. The battle was particularly interesting... and how Lyra and Will go into the after life. I liked how the book ended; I was almost anticipating a Harry Potter conclusion where they fast-forward into the future and Lyra and Will live happily ever after but that wasn't the case. I think the ending was a lot more realistic and in turn a lot more satisfying; however depressing. There were a few bits of the story that I found unbearable-1. The pages dedicated to the Mulefa and Mary, I suppose it was important in gelling Mary's part in the story but it was dead boring.2. Lyra and Will making out was just... wrong! They're only 12 or 13! They're only children! Why, Oh why did Philp Pullman feel the need to add romance into a novel about children??3. Why does Lyra take a backseat? Her spoilt and mulish character could be tolerated in the previous two books but in the Amber Spyglass all of it shrinks away as the heroine becomes dependent on Will- the new hero. Why aren't the feminists of the world taking this up with Pullman?",5,0.9738,0.074,0.76,0.166,0.6037878787878788,NEGATIVE,0.9999
106,57209691,05/24/2009,1.0,"Lamest lame ending of all the lame endings that ever lamed. Artificial drama for no readily explicable reason. ""Oh! We love each other but cannot stay together, because this otherwise irrelevant-to-the-story effect means that it would get unhealthy after a decade or so. And we can't just cross back and forth because this knife that we have been using left right and center is bad for the structure of the universe, so we must never ever use it again. Except half a dozen times in the course of saying goodbye. And of course every time we used it in the process of saying goodbye is a decade we could have lived together. But whatever; our pathos is heartrending. Trust us; we said so.""The rest of the third book wavers between nonsensical and ok, but the ending is so ridiculous and contrived that it would ruin anything it was attached to anyways, so it doesn't matter.",5,-0.9517,0.157,0.788,0.055,0.4663359788359788,NEGATIVE,1.0
107,3646038295,12/18/2020,5.0,"I absolutely loved the trilogy. Not quite the ending, though :( (sigh)",5,0.3167,0.18,0.559,0.261,0.9,POSITIVE,0.9938
108,19814802,04/09/2008,1.0,"A waste of time. After reading the first 2 books in the series I wanted to see how it all ended. Wow I was not impressed. The story, although it is a fantasy, seemed utterly ridiculous. And if I read into the story I even find it somewhat disturbing. More characters and more story lines were introduced and finished abruptly and at odd times. Oh and then he died . . . It seemed like the author was just trying to finish the story with no regard to the plot line. I could rant and rant, but the bottom line is DON'T WASTE YOUR TIME with this book.",5,-0.5522,0.151,0.776,0.073,0.5803030303030302,NEGATIVE,1.0
109,390192076,08/12/2012,1.0,"Pullman is a writer who thinks he's open-minded, when all he is is a burner of straw men. Reading this book made me look up some background about him, where I found he is the most arrogant writer I have ever had the misfortune to read.It's also ironic that he's totally unaware of the way he forces his ideology down readers' throats, when that is the very thing he claims to loathe more than anything in other writers. This man has clearly never faced his shadow.A disappointing end to a brilliantly-begun series.",5,-0.8685,0.139,0.833,0.028,0.5147222222222221,NEGATIVE,0.9998
110,858258584,02/18/2014,5.0,"I miss Lyra and Will already and wish I could live inside all the worlds of His Dark Materials forever. I will always cherish these books and Philip Pullman's beautiful and astonishingly imaginative prose. I wish I had a daemon! The ending is achingly sad, yet hopeful and Lyra's coming of age is expertly managed, I feel like I know her as a friend and wish she were real. I really hope the book of dust comes out soon! I'm having major withdrawals already. ",5,0.9708,0.049,0.663,0.288,0.6285714285714284,POSITIVE,0.9998
111,2025655816,06/10/2017,5.0,"One day, I'll be rereading this entire trilogy and then I'll also write a review. But for now, I just need more time to process EVERYTHING that happened here. Its safe to say that I found His Dark Materials, and The Amber Spyglass in particular brilliant, and Pullman's views on religion fascinating. More to come... One day... ",5,0.8807,0.0,0.833,0.167,0.5885416666666667,POSITIVE,0.9975
112,1294650849,05/31/2015,4.0,"Wow, ..wow!! What a brilliant final! A lot of things happend in this book and I enjoyed every single page of it. I already miss Lyra. This book hat made me smile and cry at the same time. :) Im glade that I finally read this series.",5,0.927,0.082,0.614,0.303,0.6821428571428572,POSITIVE,0.9997
113,2780269970,04/11/2019,5.0,"This is the last of the trilogy (although there is now a series of prequels), and I think this is the best of the bunch.It’s ties up all the loose ends and I love the way it introduces different animals and the it also has a dark side to it.I love these books and they appeal to all ages.",5,0.9062,0.035,0.774,0.191,0.4051282051282051,POSITIVE,0.9996
114,2291371852,05/06/2018,4.0,Wished for a different ending. Hope for a sequel someday! ,5,0.4926,0.0,0.687,0.313,0.6,NEGATIVE,0.9797
115,2520191190,09/05/2018,4.0,A beautiful conclusion to a beautiful series.,5,0.8316,0.0,0.278,0.722,1.0,POSITIVE,0.9997
116,2931095285,08/14/2019,5.0,"I thoroughly enjoyed revisiting the final book of Philip Pullman's ""His Dark Materials"" trilogy via this excellent, brilliantly performed full-cast audiobook.",5,0.918,0.0,0.587,0.413,0.82,POSITIVE,0.9995
