,review_id,date,rating,text,num_likes,Vader_score,Vader_neg,Vader_neu,Vader_pos,TextBlob_sub,Flair_sent,Flair_conf
35,2353974407,06/23/2018,3.0,"C.S. Lewis was better at putting Jesus in his books that Pullman is at putting atheism in his. Then again, religion is a better a story, it’s more seducing, it offers more comfort.This last instalment of His Dark Materials failed to live up to the promise of the first book. It felt messy and was losing its magic. The world seemed thin and the characters started behaving at odds with their previously established personalities.The biggest disappointment was Lyra, who turned into a right ‘save me’ screaming doormat. Story of the nun losing her religion because of some hunky Italian and marzipan cake was just like watching some Dawkins bro troll thinking he won a twitter argument but really he only defeated a strawman he built for himself. Mrs Coulter’s transformation into a loving mother was as believable as Ann Coulter’s transformation into a decent person would be. And last but not least, if you’re gonna make sexy times such an important, game-changing plot point, try to make your romance a little bit more believable.The underworld adventures were interesting enough, and the whole thing was somewhat readable, so all in all three stars but this will be my final trip with Pullman.",28,0.9584,0.079,0.772,0.15,0.5136160714285714,NEGATIVE,1.0
36,13636983,01/26/2008,3.0,"In The Amber Spyglass Philip Pullman commits two serious authorial sins: he gets preachy and he loses control of his story. The result is book that, while excellent in places, is somewhat less enjoyable than the first two volumes of His Dark Materials.In The Golden Compass and The Subtle Knife the narrative focused on Lyra and Will, the two main characters. In this book the action jumps between their story and three or four others, which are at times peripheral and uninteresting. The most egregious case is the storyline that follows Father Gomez, the priest sent to kill Lyra. This story goes nowhere: he never encounters Lyra and is eliminated by a character we thought had left the book several hundred pages previously. His story serves no purpose other than to inject some cheap tension and offer a platform for another dig at the Magisterium/Church through the doctrine of preemptive absolution (a cool idea, it must be said). This seems to be the motivation for many of the digressions. It's almost as if Pullman had a list of neat ideas, realized this was his last chance to get them in the series, and resolved to insert them at any cost.There is also a great deal of convenience in the narrative. The alethiometers have become both deus and machina: everyone has one and can suddenly read them almost perfectly. This becomes a crutch for Pullman to move the story along without much motivation. Lord Asriel and Mrs. Coulter, at best morally ambiguous in the previous books, have become good for unclear reasons.For all these narrative problems on the fringes, the central story involving Lyra and Will is strong. The more serious problem is the preachiness. Narratively the problem is that it's very heavy handed, but I don't want to focus on that. Nor do I object to the content of Pullman's message. My problem is that Pullman seems to be mistaken about what he is preaching.Pullman has claimed in interviews that he wanted to be the anti-C. S. Lewis and that unlike Milton, who was of the Devil's party and didn't know it, he is of the Devil's party and knows it. These claims certainly helped raise the profile of the books and the film (about which less said, the better), but they are overstated. I believe, on the contrary, that Pullman is of God's party and doesn't know it. Pullman's cosmology is very similar to Christianity's, and his trilogy very similar to more overtly Christian fantasies like The Chronicles of Narnia.This may seem to be a perverse claim to make. Pullman, after all, has a chacter whom we are supposed to believe say Christianity ""is a very powerful and convincing mistake."" But it is at least a plausable reading. In the first place, Pullman's world is not atheist. It is pantheist: the universe is god. This god communicates through the alethiometer and other truth-telling devices, which not only tell the factual truth, but also give moral advice. The alethiometer frequently tells Lyra that things are right and wrong, not just true or false.Second, the relationship between god and the demonic element (The Authority) is exactly the same as it is in Christian accounts of Satan. In both cases a creature falsely claims to be the creator in order to gratify his own pride and exert his own power. This rebellion is the origin of evil in both stories. In both cases things can be set right by recognizing and rejecting the false claims of the demonic authority, a miraculous and unexpected intervention by the true god, and learning to love one another. Admittedly Christians are not pantheists, but most do not believe God is a lion either. Pullman has changed the form, but the content is remarkably similar.Finally, both Pullman and Lewis show their characters learning moral lessons that the reader is also supposed to imbibe. In both cases the characters learn to be brave, honest, and loyal; to sacrifice their own immediate desires to the needs of others; and to pursue truth and knowledge, including to question authority. Pullman is not exactly tearing up the foundations of Christian morality here.Rather than seeing Pullman as an atheist or anti-Christian author, it is more accurate to see his as part of a long tradition of English anti-clerical (and perhaps anti-papist, although that's a different review) writers. Many Christians have understood the visible Church to be corrupt and the clergy to be ambitious for power, without ceasing to be Christian. Some might even argue this is an essential truth of Christianity.",25,0.9926,0.069,0.806,0.124,0.4984882386689614,NEGATIVE,0.9997
37,9943660,12/04/2007,1.0,"I am so glad I'm done reading this series. It's languished on my bookshelf for ages before I finally decided to read it. I'm sorry I did. First, I hated how the first book was written -- so many references to things that weren't explained -- I felt like maybe I'd missed a book or something, but no, this was the FIRST one. I hated the main character, Lyra. It just wasn't grabbing me. I slogged on.The second book got better with the introduction of Will. I liked him. He seemed like a good person, with strong character, and I liked him a lot better than Lyra, who I still wanted to slap more than once.The third book really left me feeling a little sick to my stomach. As soon as I read about killing God, I felt like abandoning the book. I'm not a Bible-thumper, I haven't been to church in ages, but I have a strong belief system and to me, that just felt like blasphemy. Let me continue.I read a lot of books. A lot. And in more than a few, there are all kinds of religions and beliefs, and they don't bother me at all. I believe in tolerance, I believe in not denigrating someone for what they believe. So if others felt that killing God was cool, ok then! I just personally hated it. Calling him out by name made it seem too real and personal to me.I also didn't like the sudden intense love between Lyra and Will, although I saw that coming a mile away. They seemed too young for that mess.Essentially, I was put off by these books waaaay before the God-killing. I never liked Lyra, hated her. I did like Will and Mary. But I found this series sooooooo tedious. I think this is one of those series that you either love or hate. Check it out for yourself -- I'd be interested to know your thoughts.Lori Anderson Lori Anderson:The Store Lori Anderson:The Blog ",26,0.9886,0.122,0.655,0.223,0.5701785714285714,NEGATIVE,0.9999
38,1476982001,12/23/2015,5.0,"This book, this 3rd and final volume, is an incredible conclusion to this outstanding series. It has left me drained. It has left me heartbroken. But it has also left me in awe. I have followed Lyra Belacqua Silvertongue every step of the way on her amazing quest, and I could do it all again right now. This book is deserving of all the praise and awards it has received. It truly is a masterpiece of fantasy literature. Well done Philip Pullman, well done.",25,0.9615,0.065,0.682,0.253,0.5010714285714285,POSITIVE,0.9996
39,2038383508,07/05/2017,4.0,"This third and final installment of His Dark Materials was indeed dark, or at least much darker than the previous two. While they felt more like an adventure, this was slightly on the grim side, and not just because the kids got to spend some time in the land of the dead. While it was quite good, it was probably my least favorite of the three. ",25,-0.3953,0.13,0.762,0.109,0.4738095238095238,NEGATIVE,1.0
40,3942427454,04/25/2021,5.0,AAAAAAAAND.... I've officially finished reading another great series.Full review to come.,24,0.6249,0.0,0.709,0.291,0.75,POSITIVE,0.9986
41,3079626716,12/29/2019,3.0,"3-4 stars. This book completes the Dark Materials trilogy and I thought this is the most difficult to read. It seems to go on and on and although it ties up a lot of loose ends it did so in far greater depth than it needed to. This one is also told from several perspectives although it’s principally Will, Lyra and Mary Malone. In this one we find out just what Lord Asriel is doing, much more about the intriguing Mrs Coulter, more about Dust and why Will and Lyra are so important. They go on an incredible journey and have many dangerous encounters. I really like the introduction of some of the new creatures such as the wonderful Mulefa - sort of elephants on wheels, who Mary meets and helps and in return they assist in the making of the amber spyglass though which she can view Dust. I also love the teeny tiny chevalier Gallivespians (think Lilliputians) with a sting in their spurs who ride on the backs of dragonflies. Wonderful. There is no question the quality of the writing is exceptional and it’s so imaginative but I think the Northern Lights, Book One of the trilogy is by far the best. As the books progress it gets more complex and darker and it’s harder to engage in the storytelling. ",25,0.9631,0.035,0.849,0.115,0.5901348651348651,POSITIVE,0.9996
42,2959483127,09/03/2019,5.0,"I’m honestly pretty blown away, and I can’t believe I waiting this long to read His Dark Materials. It was wonderful, balancing thought-provoking philosophy with nearly breakneck-speed action in this final installment. Pullman crafted a world, or should I say worlds, that I found captivating, and characters whom I grew to care about deeply. Many of these characters, especially Lyra and Will, have taken a little piece of my heart, and I believe they’ll reside there from now on. What a marvelous adventure.“I have stolen ideas from every book I have ever read.”While reading this book, I did something fairly unusual for me: I kept having to write about my thoughts. Usually, I might take notes on my phone and compile them all after finishing the book, or simply take no notes at all and write a review with nothing but my final thoughts circling around in my head. I could do neither here. I had to actually write out my thoughts as they came to me, so I didn’t forget to address something that I felt was important or forget why that element felt important in the first place. Because I responded to this book so differently from most, my review is going to be a bit different, as well. The next four or five paragraphs are thoughts I had to write out while I was reading. I decided to leave them mostly in their raw form instead of polishing them up and trying to wrangle them into some kind of flow that made sense. Most of these observations and opinions are very religious in nature, as this trilogy hinges so strongly on both belief and Christian mythos, so remember that these are incredibly subjective leanings. Without further ado, here are those thoughts. If you tire of my rambling, feel free to skip down to the last two paragraphs for my final views.“I stopped believing there was a power of good and a power of evil that were outside us. And I came to believe that good and evil are names for what people do, not for what they are.”The problem with the Church of Lyra’s world isn’t their belief or their faith, which I actually saw very little evidence in the series. The problem is that they wish to erase the gift of free will. God could have prevented the original Fall of man in the form of Eve’s choice and Adam’s decision to follow her example. But He didn’t, because one of the greatest gifts He gave us was the ability to make our own decisions through free will. Mankind has no right to revoke that right from future generations, because it’s not a right we bestowed on ourselves to begin with. Instead of taking away our ability to make our own decisions, God gave us another option: accepting the gift of salvation provided by His Son’s death and resurrection.“All the history of human life has been a struggle between wisdom and stupidity.”The theory of gaining absolution before the committing of a sin is one of the most disturbing concepts I’ve encountered. It flies in the face of God’s gift and His claim to judge us by our motivations even more than by our deeds. I know that this is a tenet that was once held by very radical sects of the Church, but it’s absolutely repugnant and theologically unsound. Which actually made it a perfect fit for the Church as portrayed by Pullman.“I’m just trying to wake up - I’m so afraid of sleeping all my life and then dying - I want to wake up first. I wouldn’t care if it was just for an hour, as long as I was properly alive and awake…” A number of the epigraphs in the book come from John Milton’s Paradise Lost, which would have seemed like an almost too obvious decision from Pullman if this weren’t so obviously inspired in large part by Milton’s work. And as Milton conveyed Lucifer more as an antihero than a villain, it was easy to guess which side Pullman would favor in his narrative. However, Pullman’s take was original enough to maintain a level of unpredictability often absent in stories that are so closely linked to a retelling.“People are too complicated to have simple labels.”The descriptions of the Mulefa and their world reminded me of Perelandra, a world visited by Ransom in Lewis’s Space Trilogy. The mood, the innocence, the vast difference between the sentient creatures and humankind, and the relationship one of the adult human characters develops with these unique creatures all hearkened back to Lewis’s Ransom, and his experiences. This was a welcome addition, and was a much needed change of pace in the midst of so much action and trauma throughout the rest of the book.“What work do I have to do then?"" said Will, but went on at once, ""No, on second thought, don't tell me. I shall decide what I do. If you say my work is fighting, or healing, or exploring, or whatever you might say, I'll always be thinking about it. And if I do end up doing that, I'll be resentful because it'll feel as if I didn't have a choice, and if I don't do it, I'll feel guilty because I should. Whatever I do, I will choose it, no one else.”The spoiler that was thrown in my face when I was a child, (view spoiler)[namely that the two main characters kill God (hide spoiler)], was vastly overstated by the person who delivered it. Yes, this event does occur, but I was expecting premeditated brutality, not the quiet, heartbreaking outcome of an act of kindness. The whole worldview of this trilogy, while different from my own, was not nearly as radical as I was led to believe. This is a story of growing up, of leaving childhood when all you want to do is cling to it, of choosing one dream from many and mourning as the other possibilities move from could-be to might-have-been. It’s about doing good when it would be so much easier to be selfish, and redeeming yourself when the decisions of your past had a hand in harming others. It’s about love and free will and that fact that being able to choose your own path is both blessing and curse. I believe all these things. Where I differ from Pullman is in my belief that God is near, that He respects your choices but cares deeply about you, while Pullman conveys a God who is distant, uncaring, and fallible. I very strongly disagree with this quote and others like it for pretty obvious reasons: “The Christian religion is a very powerful and convincing mistake.” Pullman and I couldn’t be more opposed on that statement. Did that difference make me love this book, and the trilogy in its entirety, any less? Absolutely not.“When you choose one way out of many, all the ways you don't take are snuffed out like candles, as if they'd never existed.” I was honestly blown about by His Dark Materials. It is one of the richest, most lovingly crafted trilogies I’ve had the pleasure of reading. It is epic and heartbreaking and sweet and fierce, and I absolutely loved it. Both Lyra and Will, and many of their supporting cast, will always have a place in my heart. Especially Lyra. She is kind and brave and incredibly loving, and I think every little girl could use a role model like her. Each book somehow improved the volume that preceded it, and it’s a series that I believe will lend itself very well to rereadings. His Dark Materials is a modern classic of the fantasy genre for a reason, and it’s well worth your time.You can find this review and more at Novel Notions. ",23,0.9995,0.074,0.732,0.195,0.5796697191697193,POSITIVE,0.9979
43,866921248,02/27/2014,2.0,"Ah, the disappointment! The disappointment of it all!",22,-0.8011,0.545,0.455,0.0,0.4,NEGATIVE,0.9999
44,36584204,10/30/2008,1.0,"This review and reviews of the two other books in this trilogy are posted on my blog at http://inputs.wordpress.com/2008/12/1...This book is well written and the story really hooks you in, but I really disliked the philosophy Pullman is pushing. This philosophy seems to be a kind of Nietzschean materialist version of gnosticism (phew!). His is a universe which allows only of one interpretation, a place where the event is nothing but the intervention of chaos and the void and must be negated so the status quo can be restored in the full glory of its disciplinary order. It is a universe where the human curiosity for knowledge leads to ruin and annihilation (although the author overtly claims the opposite) and where the fluidity of identity must be replaced by the supremacy of the rational and by fixed identity.Just to break down those abstractions a bit. The ‘event’ is the opening up of windows to other worlds by scientists – Lord Asriel and the scientists in the Cittagazze. This leads to the beginning of the breakdown of the universe and the potential annihilation of consciousness. It is scientific curiosity about what is out there and other worlds that leads to this situation.Views on identity centre around daemons (souls). Children have daemons which can change shape until they reach puberty. After that, they become fixed which Pullman indicates several times is a good thing and a sign of maturity and wisdom. This identity also appears to maintain the social order. Once a servant always a servant. As Lyra explains in The Amber Spyglass the daemons of servants are usually dogs, indicating that these are people who need to be led and ordered around. One is not a servant due to unjust social circumstances or questionable social hierarchies but because that is what one’s nature is and one must remain as ordained. Entire armies of Tartars have wolf daemons. If one is not happy with one’s daemon – too bad – you are stuck with it. So much for social justice or working on the self as a project.Lyra, when she hits puberty, loses her intuitive ability to read the alethiometer and must then be formed by the disciplinary institution of the (boarding) school in order to develop rational techniques to read it. It is the Modernist idea that fantasy and intuition are the province of childhood and are properly replaced by adult ‘rationality’. C. Wright Mills provides a classic example of this kind of thinking in his 1959 work The Sociological Imagination.Dust appears to be conscious matter which works in sync with humans – it is both attracted to humans and generated by humans. It relies on humans to aggregate into a conscious form. Angels are beings who can’t quite pull it off in terms of really existing because they have no real material body. They are half existences (even if they are powerful) and envy the body of humans.A propos this angelic nature, Will is content to ask entities such as angels whether they are stronger or weaker than humans. When the first angel he meets, Balthamos, replies he is weaker than humans, Will bluntly tells him that he has to do what he orders him to do in that case. This theme of exploiting his position as the strongest emerges again and again. If Will thinks he can exercise power over somebody or something he doesn’t hesitate to do so. The Nietzschean hero indeed.‘God’ or ‘the Authority’ is an evil being who only wants to dominate and control Man and is frightened of the power of the latter. What we have here is an old-fashioned modernist anthropomorphic view of the universe. Humans (and the equivalents thereof) are the centre and the raison d’être of all conscious being.On another topic, the idea of a romantic interlude between two twelve year old children resulting in the salvation of the universe both present and future is both tacky and unconvincing. Why should ‘Dust’ (aka conscious matter particles) find such an event to be the stabilising point?There is no room for multiple interpretations of elements within Pullman’s cosmology, which makes it a very closed and small universe. At the same time it is hard to pin down what is actually going on satisfactorily and it all seems very confused and self-contradictory at the edges. It would appear that both scientific and spiritual forms of experimental knowledge are dangerous to the well-being of the entire universe and that the best we can do is conform to a rigid disciplinary status quo which will preserve our nature and protect us from the danger of annihilation. There is nothing but a gaping void beyond or outside of this status quo. Even when you are dead you are recycled to guarantee the ongoing existence of this ghastly stasis.In conclusion, one is left with nowhere to go at the end of Pullman’s trilogy but that would appear to be the author’s aim in any case.",21,-0.9842,0.1,0.829,0.071,0.387205638474295,NEGATIVE,0.9982
45,103744149,05/21/2010,1.0,"Irritated and inelegant. Sorry!What a dreadful pile of drivel. UNFINISHED. I didn't even care how the darn thing concludes. AND I feel like I must have been completely wrong to treat the other volumes with such enthusiasm.Longwinded tripe excruciatingly badly written. After having just finished a Chabon - there is a man who cares about every word he puts to paper - I felt so insulted to read something by somebody who clearly didn't give a brass fuck.What I don't understand is how this happens? Did he have no editor? Did the editor not give a fuck either? Do authors become so high and mighty that editors don't get to do their thing any more? The point I am making is that authors turn out rubbish all the time, but once you have arrived as a writer, you get somebody on your case that sorts out the rubbish. Not that this is his worse sin in this book, but seedpod beings. I mean to say. Fuck me dead.I am cross, in case you didn't notice.",21,-0.9727,0.171,0.777,0.051,0.60375,NEGATIVE,1.0
46,22490346,05/18/2008,5.0,"I have so much love for this book. It defines a period of my life when I felt really lost, but Will and Lyra changed my perspective of things. I love the adventure, the interconnection of all the stories, and the ultimate betrayal of Lyra and Pan. I think it's the richness with which Pullman shapes his characters and worlds that really stands out for me. After three novels, you become so deeply involved with Will, the reluctant warrior, and Lyra, with her passionate and wilful nature, that you can't help but fall in love with them. Even the Mulefa, who we see for the first time in The Amber Spyglass, have such a unique joyful nature and love for life that it's hard to resist their charm. I want to go to the world of the wheel pod trees myself and live there. To me it's perfect, no matter how many times I read it. It speaks to my soul, which is entirely the point isn't it?",20,0.9899,0.08,0.681,0.239,0.5911764705882353,POSITIVE,0.9998
