,review_id,date,rating,text,num_likes,Vader_score,Vader_neg,Vader_neu,Vader_pos,TextBlob_sub,Flair_sent,Flair_conf
15,1680545663,06/27/2016,,"Coleridge in his criticism of Paradise Lost somewhere wrote that Milton was really of the Devil's party without realising it.I don't know about Milton, but I feel that what Coleridge wrote was true of Philip Pullman channelling Milton by means of his appearance to William Blake in poetic vision while in Felpham, all of course transmogrified into a children's book - with armoured bears. Even the Jungian Daemons, anima and animus to every character, have their counterparts in Blake, while the sexual awakening of Lyra and Will prompted by Mary Malone's fond musings about Marzipan is the fruit of Milton's conception of Adam and Eve in Eden.Three paths are open to me at this stage. The reinterpretation of Milton by means of Blake by Pullman, His Dark Materials as anti-Narnia, and the trilogy as a profoundly religious work written by a non-believer. All of these together place Pullman's work in a dialectic relationship with a dissenting Protestant tradition in English literature, these books are part of an ongoing conversation about culture, about Britain, and also about the family and upbringing. If on the one hand Pullman was inspired to reinterpret Milton and Blake then he was also writing in response to C.S. Lewis by writing an anti-Narnia. The world of Narnia is a closed and tightly knit one. We are always in a family circle, family is always sufficient and saves a child from outside influences (so long as you are not a pubescent girl and have no thought of entering into adult sexuality) which are always wicked. Authority is good and directly experienced, although not comprehensible (because Jesus isn't a tame lion for goodness sake). And curiously the most we know about any of the parents in any of the Narnia books is the sickly mother from The Magician's Nephew.Pullman takes an opposite approach. The family is nothing, its influence is weak. The child is open to the world, the world is a place of adventure, foreigners are friends rather than weird people with the wrong skin colour who are incapable of achieving salvation. Authority is fractured, remote, and corrupt. Parents are terrible role models. Witches have joy in the experience of creation, and armoured bears are proper bears who eat people rather than giant honey pawed embarrassing emanations of an Oxford Don's imagination. This is the battlefield for the dream of Oxford and what part it will play in a child's imagination. A battle fought in a culture war between Anglicanism and Dissent. If Anglicanism remains dominant - and I suspect that idea of an Establishment encompassing religious, civil, cultural, and political elites can be read across by readers into their own countries - Dissent still dissents. The down side of this incredible openness and excitement about the universe and all its many varieties of Oxford is that that the series can be diffuse, some characters are much weaker than others despite having important roles to play in the story and more seriously it is hard to take the Authority and The Church seriously as antagonists when we see the heartless cruelty of chief rebel and Miltonic Satan Lord Asriel ultimately aided and abetted by the no less hideous and beautiful Mrs Coulter. While Lyra and Will for me did not emerge as synthesis, or resolution, or an alternative to either, but somehow always remained associated with the child sacrificing Lord Asriel. And what are we to make of a Republic of Heaven established by a Lord! Can the idea of the establishment of a Republic of Heaven move us as readers when the Authority lacks authority in the author's own text, the sprawl out runs the story, in effect we are with Satan at the beginning of book three of Paradise Lost surging through the unformed void where element fights against element in never ending anarchy.But perhaps this is part of Pullman's point. The universes are such incredible places and our lives so exuberant and full of adventure that we can never follow all the possible stories fully. Scheherazade, does Pullman say, did not even come close, her constant digression into other stories which interrupt each other and fall over each others toes to such an extent that there is time for a child to grow to from egg and seed to fullness in her womb before she was half way done with them gives us but a fraction of the idea of potential plot-lines a story could follow. A storyteller must then be a vicious creature, like Blake's Urizen, dividing up the seamless cloth of creation into ugly pockets and then calling himself god. Yet none of this is irreligious. Maybe for some it is an unfamiliar take, but then there is more, even to Christianity, than C.S. Lewis. Pullman's universes are steeped in religion. This is a creation, but just as in Blake's vision the original creator had been displaced by Urizen so too here power has been seized by a Demiurge. The argument is not over the place of religion in the universes but over who controls religion, is faith a matter of personal revelation or of a top down authority, a republic of spiritual equals or an absolute monarchy. A creation in which it is revealed that Dark Matter are Angels cannot be thought of as irreligious or Atheistic without exploding those concepts. What is Lyra and Will's journey to the afterlife than the Harrowing of Hell?The ending came across as apt to me. The initial breach between worlds was an act of huge violence, Will's subsequent movement using The Subtle Knife again is violent, although since he only cuts rather than blows open with a explosion not quite as bad, however still this is no gentle business, it is plainly damaging and destructive. An ending in which these holes in the fabric of existence were not knitted together would have to be unremittingly bleak. The resulting human sorrow is part of Pullman's expansive vision. Here love is inevitable, so long as one can remember the marzipan, it is not something to be feared and rejected, it gifts us the pain of parting the Newtonian opposite to joys of intimacy. For me this vast mixture of elements was hugely exciting. Dark matter and William Blake, Milton and Armoured bears, a joyful expansive approach of life in which actions have cruel consequences which our child protagonists will repent of. Way back in the first book we are told that irrespective of what other characters think or would prefer, they are engaged in a war and will have to fight, the only question is for which side. This may be true in our non-fictional lives, with the important difference that one does not need to turn coat to turn covers and sample what both sides have to offer, and even a child person is a complex thing that needs more than just one type of book to grow well.",57,0.6873,0.119,0.753,0.128,0.5609708193041524,POSITIVE,0.9664
16,24729025,06/17/2008,2.0,"This book was an experiment, and while there were moments that were clever and compelling and emotionally resonant, as a whole, the experiment failed. That experiment was to take a piece of complex, religious poetry intended for adults (Paradise Lost), turn it on its head, and make it into an anti-religion/coming-of-age allegory for children. Even though Pullman ultimately failed to create a believable, subtle, or controlled narrative universe, even The Amber Spyglass did have its good moments.Pullman's writing is still as vivid and engaging as it was in the first two books, and he has a good sense of how to write exciting and suspenseful action scenes. He has a knack for describing landscapes richly (he tends to describe landscapes and nature a bit more than I care for, but that's just my personal preference as a reader), and he has a passion and respect for curiosity that I find admirable. The overall message of the series, as bluntly and childishly as it was delivered, is still a worthwhile and important message to build a book around: to approach the world with vigor and curiosity, to keep an open mind, to do no harm, and to seek the truth no matter how frightening it may be to do so. His vision and goals as an author are praiseworthy, and his skill with language is something that other children's authors can emulate.However, Pullman fails one very important test of novel-writing: his characters are flat. Try as I might, I simply did not care about most of the characters in the story. Lyra was basically a broken record that said things like ""I been thinkin'...let's save them!'"" and ""Let's do the right thing!"" and ""Oh, I got to do this, I got to!"" and ""I ain't the smartest, but by golly am I brave!"" She sounded like a character from Winnie-the-Pooh. ""Let's go lay down by the brambly bush and have some refreshment while we talk about what an ever so exciting and gay time we've had today, making new friends and learning a moral lesson here and there about doing The Right Thing!"" That's not even taking into account the fact that she was a pig-headed brat throughout ¾ of the entire series. It wasn't until a flood of estrogen poured into her system when she spontaneously hit puberty that she finally stopped stamping her foot and listening seriously to the advice and wisdom that adults had to offer.Sure, she and Will were brave and strong and self-sacrificing. But neither of them really developed into anything beyond Pullman's simplistic notion of golden-hearted goodness. Despite all the fuss Pullman made about Lyra being ""tempted,"" she was never really tempted at all. She never had to face a real moral choice about right and wrong: she always knew, with absolute certainty, what was right and what was wrong. Her personality was cloying and saccharine when she wasn't being abrasive and stubborn, and I couldn't stand her. Will was a bit better, but even he failed to live up to my expectations of character development. And if those two – the main characters – weren't adequately developed, who else in the series could be? One of the only characters who came anywhere near being interesting and unpredictable was Mrs. Coulter, who was basically a Snape figure, but less plausible and not as much fun to read about. Dr. Malone also had her moments as a developed character, but unfortunately she only made up a small part of the series as a whole.Mrs. Coulter was interesting, but ultimately, no one was able to give a satisfactory reason to explain her change of heart. Maybe she still had the hots for Asriel, maybe her maternal instinct kicked in 12 years too late, maybe she genuinely thought Lyra was a good kid...or maybe Pullman just needed to create a series where the main character's mother loved her and was willing to stretch the reader's suspension of disbelief as much as he needed to in order to get there. Mrs. Coulter claimed to love Lyra, but she never had a real, honest conversation with her, never respected her rights, never apologized to her (and apologies are oh so very important in this series, because it's The Right Thing To Do), never had any real reason to change her mind about Lyra other than the fact that Lyra turned out to be ""special."" Throughout the whole book, the reader is wondering whether Mrs. Coulter is a double agent, or a triple agent, or just a plain wacked-out, twisted evil woman who works for herself and no one else. And in the end, even though she nobly sacrifices herself to bring about something or other good, I never really felt convinced of her goodness because there was no solid rationale for it. It just felt like Pullman pulling the puppet-strings and saying, ""You're a good mother now!"" Asriel, on the other hand, is never redeemed, as far as I'm concerned, not even through author-intervention. He's still as ruthless, pitiless, cold, and calculating as he was from the very beginning – so how are we supposed to root for Asriel's side when both he and Mrs. Coulter are no better than the enemy they're fighting?Pullman was also bad at giving satisfying justifications for his other characters' motives. In this book, Lyra suddenly comes up with the idea that she wants to visit the Land of the Dead. Why didn't she think of this in the second book? Why haven't we heard more about her guilt if it really has been eating her up all this time? Why is an apology worth more than four people's lives? Why is there a Land of the Dead at all, since we've heard nothing about it until now and it doesn't really fit with the whole, you know, atheism thing? The more perilous and ridiculous the journey to the Land of the Dead seems, and the more people warn Lyra about the dangers of going there, the more stubborn she becomes. Will has an equally pathetic reason for wanting to visit his father. To do what? How can you possibly establish a connection with the ghost of a person you didn't know well even when they were alive? The entire enterprise of going to the Land of the Dead seemed to be Pullman's way of engineering an ""end to death,"" because it fits with the whole disobeying-God theme in Paradise Lost. When I realized that Pullman was going to stick with the allegory even if it didn't make sense within the world he had created, I couldn't help but lose a lot of respect for the book.Why was it forbidden for Will to think of his mother, which would distract him from his mission, but it was ok for Lyra to obssess about Roger and drag herself and others into peril just to assuage her own guilt? There never was a good reason given for why Will had to forget all about his mother in order to keep the knife intact, but Lyra's obsession with Roger was allowed to be a major driving force in the narrative. Is Roger more important than Will's mother? Certainly not from my perspective. Roger is even more flat than Will and Lyra as far as characters go. He wasn't even interesting when he was alive – why should I care about him now that he's dead? Because Roger was dead (which itself served no other purpose than to make Asriel look like a jerk), and because Pullman needed to force the characters to go to the Land of the Dead, he played up Lyra's part in Roger's death and tried to convince the reader that Roger was actually quite important, and ever so helpful and good and true. I got extremely tired of the whole ""Huzzah, let's rescue him!"" mentality of the characters. It's the same old epic, unrealistically high stakes, the same old Characters of Destiny who must fulfill a prophecy of some kind in order to save the world.Which brings me to my annoyance with the end of the book. Pullman pulled out all the stops on this one. Will and Lyra are experiencing ""true love,"" no matter that they're only twelve years old and have known each other for a few months! Did I mention that they're twelve years old? I balked at the dramatic and maudlin ending because I could not get over the fact that these were pre-teens in the most exaggerated throes of hormone-driven passion and Pullman wanted us to take this seriously, wanted us to believe this was ""true love."" Maybe my cynicism about the ending is just a symptom of the fact that I'm older than the target audience for this book. Still, there is clearly a subtext to the series that Pullman put in there for the benefit of adults. Why would he insult his adult readers by holding up this extremely young, inexperienced, twelve-year-old couple as the paragon of romantic love?From a logistical point of view, it doesn't even seem plausible that Will and Lyra had to be separated at all. Pullman wanted a tragic, ""coming-of-age"" ending, so he invented plot hooks to get there. The fact is, if there's enough wonder and curiosity and open-mindedness and kindness in the world to keep one window open, then surely there's enough to keep two open. I'm not convinced that things would be just fine with a giant window open for the rest of time to let hordes of the dead escape, but the universe would erupt into nothingness if a small, person-sized hole was left open for the next 60 years or so, just until Will and Lyra died and no longer needed it. Pullman dangled out the possibility of a happy ending, but then, for a completely arbitrary and author-generated reason, he shut down that possibility so that Will and Lyra could ""grow up"" or ""lose their innocence"" or some other platitude. I understand that being separated from each other was Pullman's way of representing their exile from Paradise, but again, this is another case where he's letting the allegory dictate how the story will turn out rather than directing and crafting his own story according to what makes the most sense. Oh, and for the record: nobody kills God in this book. Rather than railing against this book for the supposed death of God, why don't people instead rail against this book for being bad? ",55,0.9813,0.129,0.723,0.148,0.5381998026483324,NEGATIVE,0.9994
17,1252382700,10/19/2019,3.0,"I just wasn’t a huge fan of this series in general but really wanted to complete the trilogy and give it a fair chance. For me too much was happening in this book, one wild thing after another. It also seemed kind of fragmented. The ending wasn’t very satisfying, with lots of the ‘answers’ or ‘missing pieces’ being filled in by more minor character who figured it out with any explanation, they just turn up with the knowledge we have been looking for in three books. I’m giving it three stars because I can see why someone else might have enjoyed it. It’s clever and interesting.",54,0.9804,0.0,0.767,0.233,0.5677083333333334,NEGATIVE,1.0
18,306921924,04/05/2012,5.0,"I’ve finally finished my reread of His Dark Materials before starting The Book of Dust. It is literally decades since I read it and all I could remember was that I loved it, and the mulefa. But of course there was so much more to it than that. And I cried my eyes out at the end.It also made me feel like I’d love to chat to Philip Pullman about his metaphysical beliefs and the meaning of life. Wonderful writing. Wonderful story.",53,0.9468,0.028,0.778,0.194,0.675,POSITIVE,0.9992
19,808727,04/20/2007,5.0,"Heartbreaking, cynical, beautiful, potentially life-changing.",52,-0.1779,0.487,0.174,0.339,1.0,POSITIVE,0.9997
20,6178081,09/13/2007,1.0,"I actually finished this book a couple weeks ago. But life outside of goodreads, my general frustrations with the book, and the sense that reading it and thinking about it was contributing to an extended bought of grumpiness kept me from putting any thought or effort towards commenting on it here. I suppose I should get it over with now. I have to say that reading this book was at times overwhelmingly painful and my main motivation for actually finishing it was to be able to know for myself that there was no redemptive ending (at least in my eyes) to be found. Regardless of how someone may have responded to the anti-religious overtones, the shortfalls in how the characters developed, the simple resolution of problematic relationships between the characters, the disjointed storyline, the questionable timelines when trying to synchronize the disjointed stories, the shortcuts in solving problems, and my general lack of sympathy for any character exhausted me. But now after time has passed, what I shake my head at most is knowing that although this was apparently set up to be a classic quest type fantasy story the quest was only partially fulfilled (the proposed evil was only weakened not eliminated) and the main characters on this quest a) didn’t know they were on it and b) didn’t really grow through their participation in it. When a problem occurred there consistently appeared some angel or witch or bear or the compass or some other wise being to simply fill them in on what to do or what happened or will happen over the course of a couple paragraphs or pages. They didn’t really have to do much problem solving on their own-yeah they ‘experienced’ much but even then their motivations were generally self serving. Ahh, I could go on but it’s really not worth my time anymore …I’m just glad it’s over. ",44,-0.8647,0.1,0.855,0.045,0.4756854256854256,NEGATIVE,1.0
21,12816746,01/17/2008,1.0,"	This book was twisted. The plot was very contrived and the characters have lost the remaining appeal that they had in the first 2 books. The ""redemption"" of Mrs. Coulter and Lord Asriel is utterly unconvincing. Pullman makes an open mockery of God, whom he depicts as a weak, timid, helpless old being manipulated by a twisted, tryanicial angel. No, Lyra and Wil don't kill God in the end, but Pullman does. The story culminates in the predictable recreation of Adam and Eve's experience in the garden, with the conclusion that Satan had it right all along.  The problem with Pullman's ""Republic of Heaven"" ideal is that he puts too much faith in humanity. History has proven time and again that men are incapable of building and sustaining a truly benevolent society. We need God in order to build heaven. (The true God, not a warped idea of Him as seen in many religions today). The only thing worse than religious oppression is Godless oppression.  Pullman is right that men have corrupted the truth, and this is manifest in many false teachings in religions today, but he is wrong in concluding that this is God's fault, or that the very idea of God is false, and that God himself is a corrupt invention of man. There is a God, He is good, and there is a true way of worshipping him that affirms humanity. Pullman is also right that human passions have wrongfully been suppressed by many religions. But he is wrong in suggesting that there should be no higher authority to set bounds on human passions. Our passions are God-given, and God desires that we enjoy them. He teaches us, not to deny ourselves of these passions, but to deny ourselves of selfish and harmful (to ourselves or to others) expressions of these passions. There is an appropriate bounds. True religion strikes the right balance between the full expression of human passion and approprate self restraint. Finally, Pullman is also right about one thing in the Garden of Eden: it was a good thing, ultimately, that Adam and Eve partook of that fruit. It is in fact what God intended to happen. There was nothing inherently evil in the fruit itself. The sin was in doing so at Satan's urging. ",42,0.9969,0.103,0.658,0.239,0.6173160173160173,NEGATIVE,1.0
22,1469486998,12/15/2015,4.0,"This is the third instalment in the His Dark Materials series.Lyra has been captured, the worlds are tearing apart, and a new species has been discovered. This might the final book in a series but that sure doesn't mean Pullman is winding down his adventures any time soon!It's hard for me to admit that I didn't fully love this. I used to adore this series as a young teen and have so many good memories of reading it, but this reread hasn't been as fulfilling. I'll always have a soft spot in my heart for this entire series and really loved the latter half of this book, but the former portion felt like a bit of a slog. It was always a surprise to me, as I remember little from my childhood reads, to find so many new elements included in the series conclusion! I also found the religions undertones more and more prominent and while it made for fascinating philosophical discussions it also wasn't always what I wanted to read about.The book closed at it opened, with Lyra at Oxford, which felt like a satisfying conclusion for me. Lyra was always the individual I read this series for and was always the protagonist I was keen to return to. The final pages left me eager to see how she will grow from her adventures and what new ones she will experience in the follow-on series.",43,0.9941,0.024,0.768,0.207,0.4715832568105295,NEGATIVE,0.9937
